{"$schema":"https://json-schema.org/draft/2020-12/schema","title":"LightroomIsSlow validation trace label","type":"object","required":["session_id","platform","lightroom_product","workload","observer_experience","reviewed_engine_output_after_label"],"properties":{"session_id":{"type":"string"},"platform":{"enum":["windows","macos"]},"lightroom_product":{"enum":["classic","cloud_desktop"]},"workload":{"type":"string"},"observer_experience":{"enum":["normal","slow","mixed","uncertain"]},"slowdown_marked":{"type":"boolean"},"reproduced":{"type":["boolean","null"]},"notes":{"type":["string","null"]},"reviewed_engine_output_after_label":{"const":true}},"additionalProperties":false}